{
  "company_name": "anon_b3183b05e185665b",
  "country": "US",
  "deck_uri": "coh://local/historical-corpus/seeds/80ff8af4-c117-741b-b29a-a0341aeb2257/deck.pdf",
  "domain_primary": "fintech",
  "eligibility": {
    "consent_documented": true,
    "date_window_ok": true,
    "evidence_floor_ok": false,
    "no_training_overlap_ok": true
  },
  "evidence_floor": {
    "n_metrics_cited": 1,
    "n_propositions": 4,
    "n_sources_cited": 0
  },
  "memo_uri": "coh://local/historical-corpus/seeds/80ff8af4-c117-741b-b29a-a0341aeb2257/memo.md",
  "pitch_id": "80ff8af4-c117-741b-b29a-a0341aeb2257",
  "pitch_year": 2012,
  "provenance": {
    "consent_documented": true,
    "ingested_at": "2026-04-25T00:00:00+00:00",
    "ingestion_run_id": "ing_seed00000000seed",
    "source": "synthetic"
  },
  "schema_version": "1",
  "transcript_uri": "coh://local/historical-corpus/seeds/80ff8af4-c117-741b-b29a-a0341aeb2257/transcript.txt"
}
