{
  "company_name": "anon_4dd66472eaa625af",
  "country": "SG",
  "deck_uri": "coh://local/historical-corpus/seeds/5f5c62d2-b3b5-7620-82f1-d82a2a40c36c/deck.pdf",
  "domain_primary": "consumer",
  "eligibility": {
    "consent_documented": true,
    "date_window_ok": true,
    "evidence_floor_ok": true,
    "no_training_overlap_ok": true
  },
  "evidence_floor": {
    "n_metrics_cited": 9,
    "n_propositions": 22,
    "n_sources_cited": 7
  },
  "memo_uri": "coh://local/historical-corpus/seeds/5f5c62d2-b3b5-7620-82f1-d82a2a40c36c/memo.md",
  "pitch_id": "5f5c62d2-b3b5-7620-82f1-d82a2a40c36c",
  "pitch_year": 2020,
  "provenance": {
    "consent_documented": true,
    "ingested_at": "2026-04-25T00:00:00+00:00",
    "ingestion_run_id": "ing_seed00000000seed",
    "source": "synthetic"
  },
  "schema_version": "1",
  "transcript_uri": "coh://local/historical-corpus/seeds/5f5c62d2-b3b5-7620-82f1-d82a2a40c36c/transcript.txt"
}
