{
  "company_name": "anon_4b5a83f76c284a6a",
  "country": "DE",
  "deck_uri": "coh://local/historical-corpus/seeds/5c70e306-34e3-7282-89c1-2b6765b9a7f7/deck.pdf",
  "domain_primary": "biotech",
  "eligibility": {
    "consent_documented": true,
    "date_window_ok": true,
    "evidence_floor_ok": true,
    "no_training_overlap_ok": true
  },
  "evidence_floor": {
    "n_metrics_cited": 9,
    "n_propositions": 22,
    "n_sources_cited": 7
  },
  "memo_uri": "coh://local/historical-corpus/seeds/5c70e306-34e3-7282-89c1-2b6765b9a7f7/memo.md",
  "pitch_id": "5c70e306-34e3-7282-89c1-2b6765b9a7f7",
  "pitch_year": 2016,
  "provenance": {
    "consent_documented": true,
    "ingested_at": "2026-04-25T00:00:00+00:00",
    "ingestion_run_id": "ing_seed00000000seed",
    "source": "synthetic"
  },
  "schema_version": "1",
  "transcript_uri": "coh://local/historical-corpus/seeds/5c70e306-34e3-7282-89c1-2b6765b9a7f7/transcript.txt"
}
