{
  "company_name": "anon_0064b6fe82f720b8",
  "country": "DE",
  "deck_uri": "coh://local/historical-corpus/seeds/532b20b0-105c-7883-8485-58ed2711c7d2/deck.pdf",
  "domain_primary": "biotech",
  "eligibility": {
    "consent_documented": true,
    "date_window_ok": true,
    "evidence_floor_ok": true,
    "no_training_overlap_ok": true
  },
  "evidence_floor": {
    "n_metrics_cited": 5,
    "n_propositions": 14,
    "n_sources_cited": 4
  },
  "memo_uri": "coh://local/historical-corpus/seeds/532b20b0-105c-7883-8485-58ed2711c7d2/memo.md",
  "pitch_id": "532b20b0-105c-7883-8485-58ed2711c7d2",
  "pitch_year": 2016,
  "provenance": {
    "consent_documented": true,
    "ingested_at": "2026-04-25T00:00:00+00:00",
    "ingestion_run_id": "ing_seed00000000seed",
    "source": "synthetic"
  },
  "schema_version": "1",
  "transcript_uri": "coh://local/historical-corpus/seeds/532b20b0-105c-7883-8485-58ed2711c7d2/transcript.txt"
}
