{
  "company_name": "anon_4e0e598faa058faf",
  "country": "GB",
  "deck_uri": "coh://local/historical-corpus/seeds/4b60c1df-8b47-70c6-a8ff-1d7b342c9d79/deck.pdf",
  "domain_primary": "healthtech",
  "eligibility": {
    "consent_documented": true,
    "date_window_ok": true,
    "evidence_floor_ok": true,
    "no_training_overlap_ok": true
  },
  "evidence_floor": {
    "n_metrics_cited": 5,
    "n_propositions": 14,
    "n_sources_cited": 4
  },
  "memo_uri": "coh://local/historical-corpus/seeds/4b60c1df-8b47-70c6-a8ff-1d7b342c9d79/memo.md",
  "pitch_id": "4b60c1df-8b47-70c6-a8ff-1d7b342c9d79",
  "pitch_year": 2014,
  "provenance": {
    "consent_documented": true,
    "ingested_at": "2026-04-25T00:00:00+00:00",
    "ingestion_run_id": "ing_seed00000000seed",
    "source": "synthetic"
  },
  "schema_version": "1",
  "transcript_uri": "coh://local/historical-corpus/seeds/4b60c1df-8b47-70c6-a8ff-1d7b342c9d79/transcript.txt"
}
