{
  "company_name": "anon_638cbabe7292c86e",
  "country": "CA",
  "deck_uri": "coh://local/historical-corpus/seeds/06a8db10-6a32-700f-8059-48a18f7c301f/deck.pdf",
  "domain_primary": "deeptech",
  "eligibility": {
    "consent_documented": true,
    "date_window_ok": true,
    "evidence_floor_ok": true,
    "no_training_overlap_ok": true
  },
  "evidence_floor": {
    "n_metrics_cited": 9,
    "n_propositions": 22,
    "n_sources_cited": 7
  },
  "memo_uri": "coh://local/historical-corpus/seeds/06a8db10-6a32-700f-8059-48a18f7c301f/memo.md",
  "pitch_id": "06a8db10-6a32-700f-8059-48a18f7c301f",
  "pitch_year": 2018,
  "provenance": {
    "consent_documented": true,
    "ingested_at": "2026-04-25T00:00:00+00:00",
    "ingestion_run_id": "ing_seed00000000seed",
    "source": "synthetic"
  },
  "schema_version": "1",
  "transcript_uri": "coh://local/historical-corpus/seeds/06a8db10-6a32-700f-8059-48a18f7c301f/transcript.txt"
}
