{
  "company_name": "anon_53b0da6ba1714658",
  "country": "SG",
  "deck_uri": "coh://local/historical-corpus/seeds/20e98ed2-55fc-7b16-83ee-cfde5e917384/deck.pdf",
  "domain_primary": "consumer",
  "eligibility": {
    "consent_documented": true,
    "date_window_ok": true,
    "evidence_floor_ok": false,
    "no_training_overlap_ok": true
  },
  "evidence_floor": {
    "n_metrics_cited": 1,
    "n_propositions": 4,
    "n_sources_cited": 0
  },
  "memo_uri": "coh://local/historical-corpus/seeds/20e98ed2-55fc-7b16-83ee-cfde5e917384/memo.md",
  "pitch_id": "20e98ed2-55fc-7b16-83ee-cfde5e917384",
  "pitch_year": 2020,
  "provenance": {
    "consent_documented": true,
    "ingested_at": "2026-04-25T00:00:00+00:00",
    "ingestion_run_id": "ing_seed00000000seed",
    "source": "synthetic"
  },
  "schema_version": "1",
  "transcript_uri": "coh://local/historical-corpus/seeds/20e98ed2-55fc-7b16-83ee-cfde5e917384/transcript.txt"
}
