{
  "company_name": "anon_0851eba8a174b0b5",
  "country": "SG",
  "deck_uri": "coh://local/historical-corpus/seeds/eeb61282-c100-7405-86fb-6acd769d2ea0/deck.pdf",
  "domain_primary": "consumer",
  "eligibility": {
    "consent_documented": true,
    "date_window_ok": true,
    "evidence_floor_ok": false,
    "no_training_overlap_ok": true
  },
  "evidence_floor": {
    "n_metrics_cited": 1,
    "n_propositions": 4,
    "n_sources_cited": 0
  },
  "memo_uri": "coh://local/historical-corpus/seeds/eeb61282-c100-7405-86fb-6acd769d2ea0/memo.md",
  "pitch_id": "eeb61282-c100-7405-86fb-6acd769d2ea0",
  "pitch_year": 2020,
  "provenance": {
    "consent_documented": true,
    "ingested_at": "2026-04-25T00:00:00+00:00",
    "ingestion_run_id": "ing_seed00000000seed",
    "source": "synthetic"
  },
  "schema_version": "1",
  "transcript_uri": "coh://local/historical-corpus/seeds/eeb61282-c100-7405-86fb-6acd769d2ea0/transcript.txt"
}
