{
  "company_name": "anon_074fa2768168ff7e",
  "country": "DE",
  "deck_uri": "coh://local/historical-corpus/seeds/db2869f9-1ef7-7815-8032-31cb21c528e7/deck.pdf",
  "domain_primary": "biotech",
  "eligibility": {
    "consent_documented": true,
    "date_window_ok": true,
    "evidence_floor_ok": false,
    "no_training_overlap_ok": true
  },
  "evidence_floor": {
    "n_metrics_cited": 2,
    "n_propositions": 9,
    "n_sources_cited": 1
  },
  "memo_uri": "coh://local/historical-corpus/seeds/db2869f9-1ef7-7815-8032-31cb21c528e7/memo.md",
  "pitch_id": "db2869f9-1ef7-7815-8032-31cb21c528e7",
  "pitch_year": 2016,
  "provenance": {
    "consent_documented": true,
    "ingested_at": "2026-04-25T00:00:00+00:00",
    "ingestion_run_id": "ing_seed00000000seed",
    "source": "synthetic"
  },
  "schema_version": "1",
  "transcript_uri": "coh://local/historical-corpus/seeds/db2869f9-1ef7-7815-8032-31cb21c528e7/transcript.txt"
}
